<?xml version="1.0" encoding="UTF-8"?>
<templates 
    xmlns:xsl="http://www.w3.org/1999/XSL/Transform" 
    xmlns:xsi="http://www.w3.org/2001/XMLSchema-instance" 
    xsi:noNamespaceSchemaLocation="../../xsd/marc2lrm.rules.xsd">
    <!-- keyfilter is used to remove punctuation etc. from the values that are used in the keystring -->
    <keyfilter>lower-case(replace($key, ' ', ''))</keyfilter>
    <!-- PERSONS -->
    <entity tag="100" condition="*:subfield/@code = '1p'" type="http://rdaregistry.info/Elements/c/C10004" templatename="MARC21-100-Person" label="Person">
        <note>Creator identified with the help of field 100</note>
        <attributes>
            <datafield tag="100">
                <subfield code="a" type="http://rdaregistry.info/Elements/a/P50111" select="frbrizer:trim(.)" label="has name of the person"/>
                <subfield code="d" type="http://rdaregistry.info/Elements/a/P50107" select="frbrizer:trim(.)" label="has date associated with the person"/>
                <subfield code="1p" type="http://rdaregistry.info/Elements/a/P50094" label="has identifier for person"/>
            </datafield>
        </attributes>
        <key order="1">
            <element>frbrizer:create-personid(*:datafield[@tag='100'])</element>
        </key>
        <relationships>
            <!-- Person to work relationship  -->
            <!--<relationship condition="not(*:subfield[@code = '4'])" type="http://rdaregistry.info/Elements/a/P50195" itype="http://rdaregistry.info/Elements/w/P10061">
                <target entity="MARC21-240-Work"/>
                <target entity="MARC21-245-Work"/>
            </relationship>-->
            <relationship condition="not(*:subfield[@code = '4']) " type="http://rdaregistry.info/Elements/a/P50195" itype="http://rdaregistry.info/Elements/w/P10061">
                <target entity="MARC21-240-Work"/>            
            </relationship>
            <relationship condition="*:subfield[@code = '4'] = ('aut')" type="http://rdaregistry.info/Elements/a/P50195" itype="http://rdaregistry.info/Elements/w/P10061">
                <target entity="MARC21-240-Work"/>
                <target entity="MARC21-245-Work"/>
                <target entity="MARC21-700-Work" condition="frbrizer:linked($this_field, $target_field)"/>                
            </relationship>
            <relationship condition="*:subfield[@code = '4'] = ('drt')" type="http://rdaregistry.info/Elements/a/P50048" itype="http://rdaregistry.info/Elements/w/P10013">
                <target entity="MARC21-240-Work"/>
                <target entity="MARC21-245-Work"/>
            </relationship>
        </relationships>
    </entity>
    
    <entity tag="600" condition="*:subfield/@code = '1p'" type="http://rdaregistry.info/Elements/c/C10004" templatename="MARC21-600-Person" label="Person">
        <note>Person in a subject entry</note>
        <attributes>
            <datafield tag="600">
                <subfield code="a" type="http://rdaregistry.info/Elements/a/P50111" select="frbrizer:trim(.)" label="has name of the person"/>
                <subfield code="d" type="http://rdaregistry.info/Elements/a/P50107" select="frbrizer:trim(.)" label="has date associated with the person"/>
                <subfield code="1p" type="http://rdaregistry.info/Elements/a/P50094" label="has identifier for person"/>
            </datafield>
        </attributes>
        <key order="1">
            <element>frbrizer:create-personid(*:datafield[@tag='600'])</element>
        </key>
        <relationships>
            <!-- Person to work relationship  -->
            <relationship condition="not(*:subfield[@code = '4'])" type="http://rdaregistry.info/Elements/a/P50195" itype="http://rdaregistry.info/Elements/w/P10061">
                <target entity="MARC21-600-Work" same-field="true"/>
            </relationship>
            <relationship condition="*:subfield[@code = '4'] = ('aut')" type="http://rdaregistry.info/Elements/a/P50195" itype="http://rdaregistry.info/Elements/w/P10061">
                <target entity="MARC21-600-Work"  same-field="true"/>
            </relationship>
            <relationship condition="*:subfield[@code = '4'] = ('drt')" type="http://rdaregistry.info/Elements/a/P50048" itype="http://rdaregistry.info/Elements/w/P10013">
                <target entity="MARC21-600-Work"  same-field="true"/>
            </relationship>
        </relationships>
    </entity>
    
    <entity tag="700" condition="*:subfield/@code = '1p' and *:subfield[@code='4'] = ('aut', 'drt', 'act', 'trl', 'nrt', 'act')" type="http://rdaregistry.info/Elements/c/C10004" templatename="MARC21-700-Person" label="Person">
        <note>Person in 700 field (the role and relationship for the person is defined using relationship rules)</note>
        <attributes>
            <datafield tag="700">
                <subfield code="a" type="http://rdaregistry.info/Elements/a/P50111" select="frbrizer:trim(.)" label="has name of the person"/>
                <subfield code="d" type="http://rdaregistry.info/Elements/a/P50107" select="frbrizer:trim(.)" label="has date associated with the person"/>
                <subfield code="4" type="relator code"/>
                <subfield code="1p" type="http://rdaregistry.info/Elements/a/P50094" label="has identifier for person"/>
            </datafield>
        </attributes>
        <key order="1">
            <element>frbrizer:create-personid(*:datafield[@tag='700'])</element>
        </key>
        <relationships>
            <!-- Person to work relationship  -->
            <!--<relationship condition="not(*:subfield[@code = '4'])" type="http://rdaregistry.info/Elements/a/P50195" itype="http://rdaregistry.info/Elements/w/P10061">
                <target entity="MARC21-700-Work" condition="(frbrizer:linked($this_field, $target_field))"/>
                <target entity="MARC21-240-Work" condition="(frbrizer:linked($this_field, $target_field))"/>
                <target entity="MARC21-245-Work" condition="(frbrizer:linked($this_field, $target_field))"/>
            </relationship>-->
            <relationship condition="not(*:subfield[@code = '4'])" type="http://rdaregistry.info/Elements/a/P50195" itype="http://rdaregistry.info/Elements/w/P10061">
                <target entity="MARC21-700-Work" same-field="true"/>
            </relationship>
            <relationship condition="*:subfield[@code = '4'] = ('aut')" type="http://rdaregistry.info/Elements/a/P50195" itype="http://rdaregistry.info/Elements/w/P10061">
                <target entity="MARC21-700-Work" condition="(frbrizer:linked-strict($this_field, $target_field))"/>
                <target entity="MARC21-240-Work" condition="(frbrizer:linked($this_field, $target_field))"/>
                <target entity="MARC21-245-Work" condition="(frbrizer:linked($this_field, $target_field))"/>
                <target entity="MARC21-130-Work" condition="(frbrizer:linked($this_field, $target_field))"/>
            </relationship>
            <relationship condition="*:subfield[@code = '4'] = ('aui')" type="http://rdaregistry.info/Elements/a/P50195" itype="http://rdaregistry.info/Elements/w/P10061">
                <target entity="MARC21-700-Work" condition="(frbrizer:linked($this_field, $target_field))" same-field="true"/>
            </relationship>
            <relationship condition="*:subfield[@code = '4'] = ('drt')" type="http://rdaregistry.info/Elements/a/P50048" itype="http://rdaregistry.info/Elements/w/P10013">
                <target entity="MARC21-700-Work" condition="(frbrizer:linked-strict($this_field, $target_field))"/>
                <target entity="MARC21-240-Work" condition="(frbrizer:linked($this_field, $target_field))"/>
                <target entity="MARC21-245-Work" condition="(frbrizer:linked($this_field, $target_field))"/>
                <target entity="MARC21-130-Work" condition="(frbrizer:linked($this_field, $target_field))"/>
            </relationship>
            <!-- Person to expression -->
            <relationship condition="*:subfield[@code = '4'] = ('trl')" type="http://rdaregistry.info/Elements/a/P50145" itype="http://rdaregistry.info/Elements/e/P20037">
                <target entity="MARC21-700-Expression" condition="(frbrizer:linked-strict($this_field, $target_field))"/>
                <target entity="MARC21-240-Expression" condition="(frbrizer:linked($this_field, $target_field))"/>
                <target entity="MARC21-245-Expression" condition="(frbrizer:linked($this_field, $target_field))"/>
                <target entity="MARC21-130-Expression" condition="(frbrizer:linked($this_field, $target_field))"/>
            </relationship>          
            <relationship condition="*:subfield[@code = '4'] = ('nrt')" type="http://rdaregistry.info/Elements/a/P50608" itype="http://rdaregistry.info/Elements/e/P20378">
                <target entity="MARC21-700-Expression" condition="(frbrizer:linked-strict($this_field, $target_field))"/>
                <target entity="MARC21-240-Expression" condition="(frbrizer:linked($this_field, $target_field))"/>
                <target entity="MARC21-245-Expression" condition="(frbrizer:linked($this_field, $target_field))"/>
                <target entity="MARC21-130-Expression" condition="(frbrizer:linked($this_field, $target_field))"/>
            </relationship>
            <relationship condition="*:subfield[@code = '4'] = ('act')" type="http://rdaregistry.info/Elements/a/P50071" itype="http://rdaregistry.info/Elements/e/P20012">
                <target entity="MARC21-700-Expression" condition="(frbrizer:linked-strict($this_field, $target_field))"/>
                <target entity="MARC21-240-Expression" condition="(frbrizer:linked($this_field, $target_field))"/>
                <target entity="MARC21-245-Expression" condition="(frbrizer:linked($this_field, $target_field))"/>